            "[I 2025-11-30 04:04:15,687] Trial 39 finished with value: 0.5377397267655049 and parameters: {'n_camadas': 4, 'n_neuronios': 189, 'dropout': 0.2965405611658751, 'ativacao': 'tanh', 'lr': 0.0016197449765210934, 'batch_size': 43}. Best is trial 12 with value: 0.5377274681678337.\n"
          ]
        },
        {
          "output_type": "stream",
          "name": "stdout",
          "text": [
            "Melhores hiperparâmetros: {'n_camadas': 5, 'n_neuronios': 140, 'dropout': 0.3957598298656548, 'ativacao': 'tanh', 'lr': 0.009240587870945323, 'batch_size': 64}\n"
          ]
        }
      ]
    },
    {
      "cell_type": "code",
      "metadata": {
        "id": "9-FYm9Pn4iah"
      },
      "source": [
        "df = pd.read_csv(\"01-04T184148_000_mode1.csv\")  # substitua pelo seu dataset\n",
        "TARGET_COLUMN = 'pCut::Motor_Torque'\n",
        "X = df.drop(TARGET_COLUMN, axis=1).values\n",
        "y = df[TARGET_COLUMN].values\n",
        "\n",
        "X_train, X_test, y_train, y_test = train_test_split(\n",
        "    X, y, test_size=0.2, random_state=42\n",
        ")"
      ],
      "execution_count": 16,
      "outputs": []
    },
    {
      "cell_type": "code",
      "source": [
        "# TREINAR O MELHOR MODELO\n",
        "best_model = criar_modelo(study.best_trial)\n",
        "\n",
        "early = keras.callbacks.EarlyStopping(\n",
        "    patience=20,\n",
        "    restore_best_weights=True\n",
        ")\n",
        "\n",
        "best_model.fit(\n",
        "    X_train, y_train,\n",
        "    validation_split=0.2,\n",
        "    epochs=300,\n",
        "    batch_size=study.best_params[\"batch_size\"],\n",
        "    callbacks=[early],\n",
        "    verbose=1\n",
        ")\n",
        "\n",
        "y_pred = best_model.predict(X_test).flatten()\n",
        "\n",
        "rmse, mae, r2 = metricas(y_test, y_pred)\n",
        "print(\"RMSE:\", rmse)\n",
        "print(\"MAE :\", mae)\n",
        "print(\"R2  :\", r2)"
      ],
      "metadata": {
        "id": "2ztiDYui5-K7",
        "colab": {
          "base_uri": "https://localhost:8080/"
        },
        "outputId": "86acfa8f-87d3-4a98-d47a-5e1e1c3ef3e3"
      },
      "execution_count": 15,
      "outputs": [
        {
          "output_type": "stream",
          "name": "stdout",
          "text": [
            "Epoch 1/300\n",
            "\u001b[1m21/21\u001b[0m \u001b[32m━━━━━━━━━━━━━━━━━━━━\u001b[0m\u001b[37m\u001b[0m \u001b[1m3s\u001b[0m 18ms/step - loss: 2.7881 - mae: 1.2870 - val_loss: 0.5373 - val_mae: 0.6325\n",
            "Epoch 2/300\n",
            "\u001b[1m21/21\u001b[0m \u001b[32m━━━━━━━━━━━━━━━━━━━━\u001b[0m\u001b[37m\u001b[0m \u001b[1m0s\u001b[0m 8ms/step - loss: 0.4787 - mae: 0.5451 - val_loss: 0.2240 - val_mae: 0.3446\n",
            "Epoch 3/300\n",
            "\u001b[1m21/21\u001b[0m \u001b[32m━━━━━━━━━━━━━━━━━━━━\u001b[0m\u001b[37m\u001b[0m \u001b[1m0s\u001b[0m 8ms/step - loss: 0.3827 - mae: 0.4431 - val_loss: 0.1895 - val_mae: 0.3048\n",
            "Epoch 4/300\n",
            "\u001b[1m21/21\u001b[0m \u001b[32m━━━━━━━━━━━━━━━━━━━━\u001b[0m\u001b[37m\u001b[0m \u001b[1m0s\u001b[0m 8ms/step - loss: 0.2835 - mae: 0.3800 - val_loss: 0.1948 - val_mae: 0.3104\n",
            "Epoch 5/300\n",
            "\u001b[1m21/21\u001b[0m \u001b[32m━━━━━━━━━━━━━━━━━━━━\u001b[0m\u001b[37m\u001b[0m \u001b[1m0s\u001b[0m 8ms/step - loss: 0.3070 - mae: 0.3775 - val_loss: 0.1881 - val_mae: 0.3039\n",
            "Epoch 6/300\n",
            "\u001b[1m21/21\u001b[0m \u001b[32m━━━━━━━━━━━━━━━━━━━━\u001b[0m\u001b[37m\u001b[0m \u001b[1m0s\u001b[0m 8ms/step - loss: 0.2701 - mae: 0.3631 - val_loss: 0.1867 - val_mae: 0.3049\n",
            "Epoch 7/300\n",
            "\u001b[1m21/21\u001b[0m \u001b[32m━━━━━━━━━━━━━━━━━━━━\u001b[0m\u001b[37m\u001b[0m \u001b[1m0s\u001b[0m 10ms/step - loss: 0.2402 - mae: 0.3362 - val_loss: 0.2018 - val_mae: 0.3184\n",
            "Epoch 8/300\n",
            "\u001b[1m21/21\u001b[0m \u001b[32m━━━━━━━━━━━━━━━━━━━━\u001b[0m\u001b[37m\u001b[0m \u001b[1m0s\u001b[0m 8ms/step - loss: 0.2571 - mae: 0.3492 - val_loss: 0.2339 - val_mae: 0.3561\n",
            "Epoch 9/300\n",
            "\u001b[1m21/21\u001b[0m \u001b[32m━━━━━━━━━━━━━━━━━━━━\u001b[0m\u001b[37m\u001b[0m \u001b[1m0s\u001b[0m 8ms/step - loss: 0.2350 - mae: 0.3403 - val_loss: 0.1906 - val_mae: 0.3222\n",
            "Epoch 10/300\n",
            "\u001b[1m21/21\u001b[0m \u001b[32m━━━━━━━━━━━━━━━━━━━━\u001b[0m\u001b[37m\u001b[0m \u001b[1m0s\u001b[0m 8ms/step - loss: 0.2284 - mae: 0.3452 - val_loss: 0.1974 - val_mae: 0.3134\n",
            "Epoch 11/300\n",
            "\u001b[1m21/21\u001b[0m \u001b[32m━━━━━━━━━━━━━━━━━━━━\u001b[0m\u001b[37m\u001b[0m \u001b[1m0s\u001b[0m 8ms/step - loss: 0.3208 - mae: 0.3798 - val_loss: 0.2115 - val_mae: 0.3568\n",
            "Epoch 12/300\n",
            "\u001b[1m21/21\u001b[0m \u001b[32m━━━━━━━━━━━━━━━━━━━━\u001b[0m\u001b[37m\u001b[0m \u001b[1m0s\u001b[0m 8ms/step - loss: 0.2933 - mae: 0.3757 - val_loss: 0.1915 - val_mae: 0.3243\n",
            "Epoch 13/300\n",
            "\u001b[1m21/21\u001b[0m \u001b[32m━━━━━━━━━━━━━━━━━━━━\u001b[0m\u001b[37m\u001b[0m \u001b[1m0s\u001b[0m 8ms/step - loss: 0.2589 - mae: 0.3524 - val_loss: 0.2048 - val_mae: 0.3220\n",
            "Epoch 14/300\n",
            "\u001b[1m21/21\u001b[0m \u001b[32m━━━━━━━━━━━━━━━━━━━━\u001b[0m\u001b[37m\u001b[0m \u001b[1m0s\u001b[0m 9ms/step - loss: 0.2028 - mae: 0.3387 - val_loss: 0.1871 - val_mae: 0.3041\n",
            "Epoch 15/300\n",
            "\u001b[1m21/21\u001b[0m \u001b[32m━━━━━━━━━━━━━━━━━━━━\u001b[0m\u001b[37m\u001b[0m \u001b[1m0s\u001b[0m 8ms/step - loss: 0.2134 - mae: 0.3326 - val_loss: 0.1868 - val_mae: 0.3097\n",
            "Epoch 16/300\n",
            "\u001b[1m21/21\u001b[0m \u001b[32m━━━━━━━━━━━━━━━━━━━━\u001b[0m\u001b[37m\u001b[0m \u001b[1m0s\u001b[0m 8ms/step - loss: 0.2657 - mae: 0.3523 - val_loss: 0.2258 - val_mae: 0.3467\n",
            "Epoch 17/300\n",
            "\u001b[1m21/21\u001b[0m \u001b[32m━━━━━━━━━━━━━━━━━━━━\u001b[0m\u001b[37m\u001b[0m \u001b[1m0s\u001b[0m 8ms/step - loss: 0.2439 - mae: 0.3699 - val_loss: 0.1905 - val_mae: 0.3219\n",
            "Epoch 18/300\n",
            "\u001b[1m21/21\u001b[0m \u001b[32m━━━━━━━━━━━━━━━━━━━━\u001b[0m\u001b[37m\u001b[0m \u001b[1m0s\u001b[0m 8ms/step - loss: 0.2411 - mae: 0.3485 - val_loss: 0.1867 - val_mae: 0.3084\n",
            "Epoch 19/300\n",
            "\u001b[1m21/21\u001b[0m \u001b[32m━━━━━━━━━━━━━━━━━━━━\u001b[0m\u001b[37m\u001b[0m \u001b[1m0s\u001b[0m 9ms/step - loss: 0.2472 - mae: 0.3525 - val_loss: 0.1965 - val_mae: 0.3348\n",
            "Epoch 20/300\n",
            "\u001b[1m21/21\u001b[0m \u001b[32m━━━━━━━━━━━━━━━━━━━━\u001b[0m\u001b[37m\u001b[0m \u001b[1m0s\u001b[0m 8ms/step - loss: 0.2407 - mae: 0.3570 - val_loss: 0.1867 - val_mae: 0.3049\n",
            "Epoch 21/300\n",
            "\u001b[1m21/21\u001b[0m \u001b[32m━━━━━━━━━━━━━━━━━━━━\u001b[0m\u001b[37m\u001b[0m \u001b[1m0s\u001b[0m 9ms/step - loss: 0.2548 - mae: 0.3591 - val_loss: 0.2744 - val_mae: 0.4145\n",
            "Epoch 22/300\n",
            "\u001b[1m21/21\u001b[0m \u001b[32m━━━━━━━━━━━━━━━━━━━━\u001b[0m\u001b[37m\u001b[0m \u001b[1m0s\u001b[0m 8ms/step - loss: 0.3197 - mae: 0.3799 - val_loss: 0.1867 - val_mae: 0.3048\n",
            "Epoch 23/300\n",
            "\u001b[1m21/21\u001b[0m \u001b[32m━━━━━━━━━━━━━━━━━━━━\u001b[0m\u001b[37m\u001b[0m \u001b[1m0s\u001b[0m 9ms/step - loss: 0.3013 - mae: 0.3623 - val_loss: 0.1998 - val_mae: 0.3162\n",
            "Epoch 24/300\n",
            "\u001b[1m21/21\u001b[0m \u001b[32m━━━━━━━━━━━━━━━━━━━━\u001b[0m\u001b[37m\u001b[0m \u001b[1m0s\u001b[0m 9ms/step - loss: 0.2120 - mae: 0.3360 - val_loss: 0.2805 - val_mae: 0.4056\n",
            "Epoch 25/300\n",
            "\u001b[1m21/21\u001b[0m \u001b[32m━━━━━━━━━━━━━━━━━━━━\u001b[0m\u001b[37m\u001b[0m \u001b[1m0s\u001b[0m 8ms/step - loss: 0.2420 - mae: 0.3644 - val_loss: 0.1916 - val_mae: 0.3246\n",
            "Epoch 26/300\n",
            "\u001b[1m21/21\u001b[0m \u001b[32m━━━━━━━━━━━━━━━━━━━━\u001b[0m\u001b[37m\u001b[0m \u001b[1m0s\u001b[0m 9ms/step - loss: 0.2461 - mae: 0.3534 - val_loss: 0.1932 - val_mae: 0.3086\n",
            "Epoch 27/300\n",
            "\u001b[1m21/21\u001b[0m \u001b[32m━━━━━━━━━━━━━━━━━━━━\u001b[0m\u001b[37m\u001b[0m \u001b[1m0s\u001b[0m 8ms/step - loss: 0.3423 - mae: 0.3822 - val_loss: 0.2433 - val_mae: 0.3666\n",
            "Epoch 28/300\n",
            "\u001b[1m21/21\u001b[0m \u001b[32m━━━━━━━━━━━━━━━━━━━━\u001b[0m\u001b[37m\u001b[0m \u001b[1m0s\u001b[0m 8ms/step - loss: 0.2966 - mae: 0.3694 - val_loss: 0.1935 - val_mae: 0.3288\n",
            "Epoch 29/300\n",
            "\u001b[1m21/21\u001b[0m \u001b[32m━━━━━━━━━━━━━━━━━━━━\u001b[0m\u001b[37m\u001b[0m \u001b[1m0s\u001b[0m 9ms/step - loss: 0.2564 - mae: 0.3536 - val_loss: 0.2058 - val_mae: 0.3231\n",
            "Epoch 30/300\n",
            "\u001b[1m21/21\u001b[0m \u001b[32m━━━━━━━━━━━━━━━━━━━━\u001b[0m\u001b[37m\u001b[0m \u001b[1m0s\u001b[0m 9ms/step - loss: 0.2055 - mae: 0.3442 - val_loss: 0.3117 - val_mae: 0.4365\n",
            "Epoch 31/300\n",
            "\u001b[1m21/21\u001b[0m \u001b[32m━━━━━━━━━━━━━━━━━━━━\u001b[0m\u001b[37m\u001b[0m \u001b[1m0s\u001b[0m 9ms/step - loss: 0.3531 - mae: 0.4217 - val_loss: 0.1866 - val_mae: 0.3054\n",
            "Epoch 32/300\n",
            "\u001b[1m21/21\u001b[0m \u001b[32m━━━━━━━━━━━━━━━━━━━━\u001b[0m\u001b[37m\u001b[0m \u001b[1m0s\u001b[0m 9ms/step - loss: 0.2729 - mae: 0.3678 - val_loss: 0.2355 - val_mae: 0.3813\n",
            "Epoch 33/300\n",
            "\u001b[1m21/21\u001b[0m \u001b[32m━━━━━━━━━━━━━━━━━━━━\u001b[0m\u001b[37m\u001b[0m \u001b[1m0s\u001b[0m 9ms/step - loss: 0.2733 - mae: 0.3747 - val_loss: 0.1960 - val_mae: 0.3338\n",
            "Epoch 34/300\n",
            "\u001b[1m21/21\u001b[0m \u001b[32m━━━━━━━━━━━━━━━━━━━━\u001b[0m\u001b[37m\u001b[0m \u001b[1m0s\u001b[0m 10ms/step - loss: 0.2767 - mae: 0.3619 - val_loss: 0.2006 - val_mae: 0.3419\n",
            "Epoch 35/300\n",
            "\u001b[1m21/21\u001b[0m \u001b[32m━━━━━━━━━━━━━━━━━━━━\u001b[0m\u001b[37m\u001b[0m \u001b[1m0s\u001b[0m 8ms/step - loss: 0.2876 - mae: 0.3613 - val_loss: 0.2152 - val_mae: 0.3341\n",
            "Epoch 36/300\n",
            "\u001b[1m21/21\u001b[0m \u001b[32m━━━━━━━━━━━━━━━━━━━━\u001b[0m\u001b[37m\u001b[0m \u001b[1m0s\u001b[0m 9ms/step - loss: 0.2416 - mae: 0.3426 - val_loss: 0.2466 - val_mae: 0.3911\n",
            "Epoch 37/300\n",
            "\u001b[1m21/21\u001b[0m \u001b[32m━━━━━━━━━━━━━━━━━━━━\u001b[0m\u001b[37m\u001b[0m \u001b[1m0s\u001b[0m 9ms/step - loss: 0.3039 - mae: 0.3920 - val_loss: 0.2158 - val_mae: 0.3348\n",
            "Epoch 38/300\n",
            "\u001b[1m21/21\u001b[0m \u001b[32m━━━━━━━━━━━━━━━━━━━━\u001b[0m\u001b[37m\u001b[0m \u001b[1m0s\u001b[0m 8ms/step - loss: 0.2281 - mae: 0.3495 - val_loss: 0.2223 - val_mae: 0.3426\n",
            "Epoch 39/300\n",
            "\u001b[1m21/21\u001b[0m \u001b[32m━━━━━━━━━━━━━━━━━━━━\u001b[0m\u001b[37m\u001b[0m \u001b[1m0s\u001b[0m 15ms/step - loss: 0.3011 - mae: 0.3752 - val_loss: 0.2159 - val_mae: 0.3618\n",
            "Epoch 40/300\n",
            "\u001b[1m21/21\u001b[0m \u001b[32m━━━━━━━━━━━━━━━━━━━━\u001b[0m\u001b[37m\u001b[0m \u001b[1m1s\u001b[0m 12ms/step - loss: 0.2003 - mae: 0.3356 - val_loss: 0.1871 - val_mae: 0.3111\n",
            "Epoch 41/300\n",
            "\u001b[1m21/21\u001b[0m \u001b[32m━━━━━━━━━━━━━━━━━━━━\u001b[0m\u001b[37m\u001b[0m \u001b[1m0s\u001b[0m 13ms/step - loss: 0.2858 - mae: 0.3845 - val_loss: 0.3149 - val_mae: 0.4397\n",
            "Epoch 42/300\n",
            "\u001b[1m21/21\u001b[0m \u001b[32m━━━━━━━━━━━━━━━━━━━━\u001b[0m\u001b[37m\u001b[0m \u001b[1m0s\u001b[0m 13ms/step - loss: 0.2418 - mae: 0.3628 - val_loss: 0.2623 - val_mae: 0.4045\n",
            "Epoch 43/300\n",
            "\u001b[1m21/21\u001b[0m \u001b[32m━━━━━━━━━━━━━━━━━━━━\u001b[0m\u001b[37m\u001b[0m \u001b[1m1s\u001b[0m 11ms/step - loss: 0.2733 - mae: 0.3708 - val_loss: 0.2474 - val_mae: 0.3712\n",
            "Epoch 44/300\n",
            "\u001b[1m21/21\u001b[0m \u001b[32m━━━━━━━━━━━━━━━━━━━━\u001b[0m\u001b[37m\u001b[0m \u001b[1m0s\u001b[0m 10ms/step - loss: 0.2992 - mae: 0.3779 - val_loss: 0.1866 - val_mae: 0.3069\n",
            "Epoch 45/300\n",
            "\u001b[1m21/21\u001b[0m \u001b[32m━━━━━━━━━━━━━━━━━━━━\u001b[0m\u001b[37m\u001b[0m \u001b[1m0s\u001b[0m 9ms/step - loss: 0.2453 - mae: 0.3535 - val_loss: 0.1884 - val_mae: 0.3041\n",
            "Epoch 46/300\n",
            "\u001b[1m21/21\u001b[0m \u001b[32m━━━━━━━━━━━━━━━━━━━━\u001b[0m\u001b[37m\u001b[0m \u001b[1m0s\u001b[0m 8ms/step - loss: 0.2700 - mae: 0.3710 - val_loss: 0.1887 - val_mae: 0.3172\n",
            "Epoch 47/300\n",
            "\u001b[1m21/21\u001b[0m \u001b[32m━━━━━━━━━━━━━━━━━━━━\u001b[0m\u001b[37m\u001b[0m \u001b[1m0s\u001b[0m 8ms/step - loss: 0.2565 - mae: 0.3580 - val_loss: 0.1897 - val_mae: 0.3049\n",
            "Epoch 48/300\n",
            "\u001b[1m21/21\u001b[0m \u001b[32m━━━━━━━━━━━━━━━━━━━━\u001b[0m\u001b[37m\u001b[0m \u001b[1m0s\u001b[0m 9ms/step - loss: 0.2301 - mae: 0.3482 - val_loss: 0.1896 - val_mae: 0.3049\n",
            "Epoch 49/300\n",
            "\u001b[1m21/21\u001b[0m \u001b[32m━━━━━━━━━━━━━━━━━━━━\u001b[0m\u001b[37m\u001b[0m \u001b[1m0s\u001b[0m 10ms/step - loss: 0.2815 - mae: 0.3691 - val_loss: 0.2649 - val_mae: 0.4067\n",
            "Epoch 50/300\n",
            "\u001b[1m21/21\u001b[0m \u001b[32m━━━━━━━━━━━━━━━━━━━━\u001b[0m\u001b[37m\u001b[0m \u001b[1m0s\u001b[0m 8ms/step - loss: 0.2818 - mae: 0.3801 - val_loss: 0.2562 - val_mae: 0.3993\n",
            "Epoch 51/300\n",
            "\u001b[1m21/21\u001b[0m \u001b[32m━━━━━━━━━━━━━━━━━━━━\u001b[0m\u001b[37m\u001b[0m \u001b[1m0s\u001b[0m 8ms/step - loss: 0.2610 - mae: 0.3718 - val_loss: 0.1874 - val_mae: 0.3039\n",
            "Epoch 52/300\n",
            "\u001b[1m21/21\u001b[0m \u001b[32m━━━━━━━━━━━━━━━━━━━━\u001b[0m\u001b[37m\u001b[0m \u001b[1m0s\u001b[0m 8ms/step - loss: 0.2615 - mae: 0.3693 - val_loss: 0.1983 - val_mae: 0.3380\n",
            "Epoch 53/300\n",
            "\u001b[1m21/21\u001b[0m \u001b[32m━━━━━━━━━━━━━━━━━━━━\u001b[0m\u001b[37m\u001b[0m \u001b[1m0s\u001b[0m 8ms/step - loss: 0.2232 - mae: 0.3415 - val_loss: 0.1921 - val_mae: 0.3074\n",
            "Epoch 54/300\n",
            "\u001b[1m21/21\u001b[0m \u001b[32m━━━━━━━━━━━━━━━━━━━━\u001b[0m\u001b[37m\u001b[0m \u001b[1m0s\u001b[0m 10ms/step - loss: 0.2400 - mae: 0.3627 - val_loss: 0.2056 - val_mae: 0.3228\n",
            "Epoch 55/300\n",
            "\u001b[1m21/21\u001b[0m \u001b[32m━━━━━━━━━━━━━━━━━━━━\u001b[0m\u001b[37m\u001b[0m \u001b[1m0s\u001b[0m 11ms/step - loss: 0.2857 - mae: 0.3838 - val_loss: 0.2110 - val_mae: 0.3292\n",
            "Epoch 56/300\n",
            "\u001b[1m21/21\u001b[0m \u001b[32m━━━━━━━━━━━━━━━━━━━━\u001b[0m\u001b[37m\u001b[0m \u001b[1m0s\u001b[0m 8ms/step - loss: 0.2397 - mae: 0.3502 - val_loss: 0.1873 - val_mae: 0.3039\n",
            "Epoch 57/300\n",
            "\u001b[1m21/21\u001b[0m \u001b[32m━━━━━━━━━━━━━━━━━━━━\u001b[0m\u001b[37m\u001b[0m \u001b[1m0s\u001b[0m 8ms/step - loss: 0.2845 - mae: 0.3689 - val_loss: 0.1869 - val_mae: 0.3043\n",
            "Epoch 58/300\n",
            "\u001b[1m21/21\u001b[0m \u001b[32m━━━━━━━━━━━━━━━━━━━━\u001b[0m\u001b[37m\u001b[0m \u001b[1m0s\u001b[0m 9ms/step - loss: 0.2653 - mae: 0.3625 - val_loss: 0.2602 - val_mae: 0.3848\n",
            "Epoch 59/300\n",
            "\u001b[1m21/21\u001b[0m \u001b[32m━━━━━━━━━━━━━━━━━━━━\u001b[0m\u001b[37m\u001b[0m \u001b[1m0s\u001b[0m 8ms/step - loss: 0.3142 - mae: 0.4215 - val_loss: 0.1874 - val_mae: 0.3039\n",
            "Epoch 60/300\n",
            "\u001b[1m21/21\u001b[0m \u001b[32m━━━━━━━━━━━━━━━━━━━━\u001b[0m\u001b[37m\u001b[0m \u001b[1m0s\u001b[0m 8ms/step - loss: 0.2965 - mae: 0.3763 - val_loss: 0.1922 - val_mae: 0.3075\n",
            "Epoch 61/300\n",
            "\u001b[1m21/21\u001b[0m \u001b[32m━━━━━━━━━━━━━━━━━━━━\u001b[0m\u001b[37m\u001b[0m \u001b[1m0s\u001b[0m 8ms/step - loss: 0.2818 - mae: 0.3775 - val_loss: 0.1872 - val_mae: 0.3040\n",
            "Epoch 62/300\n",
            "\u001b[1m21/21\u001b[0m \u001b[32m━━━━━━━━━━━━━━━━━━━━\u001b[0m\u001b[37m\u001b[0m \u001b[1m0s\u001b[0m 8ms/step - loss: 0.2149 - mae: 0.3384 - val_loss: 0.1866 - val_mae: 0.3067\n",
            "Epoch 63/300\n",
            "\u001b[1m21/21\u001b[0m \u001b[32m━━━━━━━━━━━━━━━━━━━━\u001b[0m\u001b[37m\u001b[0m \u001b[1m0s\u001b[0m 10ms/step - loss: 0.2901 - mae: 0.3754 - val_loss: 0.1898 - val_mae: 0.3200\n",
            "Epoch 64/300\n",
            "\u001b[1m21/21\u001b[0m \u001b[32m━━━━━━━━━━━━━━━━━━━━\u001b[0m\u001b[37m\u001b[0m \u001b[1m0s\u001b[0m 8ms/step - loss: 0.2452 - mae: 0.3706 - val_loss: 0.1902 - val_mae: 0.3212\n",
            "Epoch 65/300\n",
            "\u001b[1m21/21\u001b[0m \u001b[32m━━━━━━━━━━━━━━━━━━━━\u001b[0m\u001b[37m\u001b[0m \u001b[1m0s\u001b[0m 8ms/step - loss: 0.2461 - mae: 0.3616 - val_loss: 0.1875 - val_mae: 0.3038\n",
            "Epoch 66/300\n",
            "\u001b[1m21/21\u001b[0m \u001b[32m━━━━━━━━━━━━━━━━━━━━\u001b[0m\u001b[37m\u001b[0m \u001b[1m0s\u001b[0m 8ms/step - loss: 0.2994 - mae: 0.3632 - val_loss: 0.1873 - val_mae: 0.3120\n",
            "Epoch 67/300\n",
            "\u001b[1m21/21\u001b[0m \u001b[32m━━━━━━━━━━━━━━━━━━━━\u001b[0m\u001b[37m\u001b[0m \u001b[1m0s\u001b[0m 9ms/step - loss: 0.3025 - mae: 0.3904 - val_loss: 0.1871 - val_mae: 0.3113\n",
            "Epoch 68/300\n",
            "\u001b[1m21/21\u001b[0m \u001b[32m━━━━━━━━━━━━━━━━━━━━\u001b[0m\u001b[37m\u001b[0m \u001b[1m0s\u001b[0m 10ms/step - loss: 0.2628 - mae: 0.3798 - val_loss: 0.1914 - val_mae: 0.3242\n",
            "Epoch 69/300\n",
            "\u001b[1m21/21\u001b[0m \u001b[32m━━━━━━━━━━━━━━━━━━━━\u001b[0m\u001b[37m\u001b[0m \u001b[1m0s\u001b[0m 9ms/step - loss: 0.2742 - mae: 0.3919 - val_loss: 0.2557 - val_mae: 0.3989\n",
            "Epoch 70/300\n",
            "\u001b[1m21/21\u001b[0m \u001b[32m━━━━━━━━━━━━━━━━━━━━\u001b[0m\u001b[37m\u001b[0m \u001b[1m0s\u001b[0m 9ms/step - loss: 0.3254 - mae: 0.3822 - val_loss: 0.1910 - val_mae: 0.3233\n",
            "Epoch 71/300\n",
            "\u001b[1m21/21\u001b[0m \u001b[32m━━━━━━━━━━━━━━━━━━━━\u001b[0m\u001b[37m\u001b[0m \u001b[1m0s\u001b[0m 8ms/step - loss: 0.2723 - mae: 0.3622 - val_loss: 0.1992 - val_mae: 0.3397\n",
            "Epoch 72/300\n",
            "\u001b[1m21/21\u001b[0m \u001b[32m━━━━━━━━━━━━━━━━━━━━\u001b[0m\u001b[37m\u001b[0m \u001b[1m0s\u001b[0m 9ms/step - loss: 0.2878 - mae: 0.3985 - val_loss: 0.1884 - val_mae: 0.3041\n",
            "Epoch 73/300\n",
            "\u001b[1m21/21\u001b[0m \u001b[32m━━━━━━━━━━━━━━━━━━━━\u001b[0m\u001b[37m\u001b[0m \u001b[1m0s\u001b[0m 9ms/step - loss: 0.2891 - mae: 0.3702 - val_loss: 0.1892 - val_mae: 0.3185\n",
            "Epoch 74/300\n",
            "\u001b[1m21/21\u001b[0m \u001b[32m━━━━━━━━━━━━━━━━━━━━\u001b[0m\u001b[37m\u001b[0m \u001b[1m0s\u001b[0m 9ms/step - loss: 0.2208 - mae: 0.3455 - val_loss: 0.2232 - val_mae: 0.3436\n",
            "Epoch 75/300\n",
            "\u001b[1m21/21\u001b[0m \u001b[32m━━━━━━━━━━━━━━━━━━━━\u001b[0m\u001b[37m\u001b[0m \u001b[1m0s\u001b[0m 9ms/step - loss: 0.2585 - mae: 0.3614 - val_loss: 0.1890 - val_mae: 0.3044\n",
            "Epoch 76/300\n",
            "\u001b[1m21/21\u001b[0m \u001b[32m━━━━━━━━━━━━━━━━━━━━\u001b[0m\u001b[37m\u001b[0m \u001b[1m0s\u001b[0m 9ms/step - loss: 0.2221 - mae: 0.3537 - val_loss: 0.1872 - val_mae: 0.3115\n",
            "Epoch 77/300\n",
            "\u001b[1m21/21\u001b[0m \u001b[32m━━━━━━━━━━━━━━━━━━━━\u001b[0m\u001b[37m\u001b[0m \u001b[1m0s\u001b[0m 9ms/step - loss: 0.2448 - mae: 0.3564 - val_loss: 0.1993 - val_mae: 0.3156\n",
            "Epoch 78/300\n",
            "\u001b[1m21/21\u001b[0m \u001b[32m━━━━━━━━━━━━━━━━━━━━\u001b[0m\u001b[37m\u001b[0m \u001b[1m0s\u001b[0m 9ms/step - loss: 0.2504 - mae: 0.3725 - val_loss: 0.1873 - val_mae: 0.3122\n",
            "Epoch 79/300\n",
            "\u001b[1m21/21\u001b[0m \u001b[32m━━━━━━━━━━━━━━━━━━━━\u001b[0m\u001b[37m\u001b[0m \u001b[1m0s\u001b[0m 9ms/step - loss: 0.2853 - mae: 0.3676 - val_loss: 0.2590 - val_mae: 0.3836\n",
            "Epoch 80/300\n",
            "\u001b[1m21/21\u001b[0m \u001b[32m━━━━━━━━━━━━━━━━━━━━\u001b[0m\u001b[37m\u001b[0m \u001b[1m0s\u001b[0m 8ms/step - loss: 0.2650 - mae: 0.3819 - val_loss: 0.1972 - val_mae: 0.3133\n",
            "Epoch 81/300\n",
            "\u001b[1m21/21\u001b[0m \u001b[32m━━━━━━━━━━━━━━━━━━━━\u001b[0m\u001b[37m\u001b[0m \u001b[1m0s\u001b[0m 10ms/step - loss: 0.2218 - mae: 0.3484 - val_loss: 0.1875 - val_mae: 0.3128\n",
            "Epoch 82/300\n",
            "\u001b[1m21/21\u001b[0m \u001b[32m━━━━━━━━━━━━━━━━━━━━\u001b[0m\u001b[37m\u001b[0m \u001b[1m0s\u001b[0m 10ms/step - loss: 0.2960 - mae: 0.3943 - val_loss: 0.2064 - val_mae: 0.3504\n",
            "\u001b[1m13/13\u001b[0m \u001b[32m━━━━━━━━━━━━━━━━━━━━\u001b[0m\u001b[37m\u001b[0m \u001b[1m0s\u001b[0m 8ms/step\n",
            "RMSE: 0.5377978709442248\n",
            "MAE : 0.34781986638233914\n",
            "R2  : -0.0002619782870030285\n"
          ]
        }
      ]
    },
    {
      "cell_type": "markdown",
      "metadata": {
        "id": "71cf6143"
      },
      "source": [
        "Please review the output above and let me know which column you intend to use as the `target` variable. Once you provide the correct column name, I can update the code to fix the error."
      ]
    }
  ]
}