            "[I 2025-11-30 04:02:42,271] Trial 32 finished with value: 0.5378037412061154 and parameters: {'n_camadas': 4, 'n_neuronios': 140, 'dropout': 0.42922426384178536, 'ativacao': 'tanh', 'lr': 0.003873862073686688, 'batch_size': 31}. Best is trial 12 with value: 0.5377274681678337.\n"
          ]
        },
        {
          "metadata": {
            "tags": null
          },
          "name": "stdout",
          "output_type": "stream",
          "text": [
            "\u001b[1m13/13\u001b[0m \u001b[32m━━━━━━━━━━━━━━━━━━━━\u001b[0m\u001b[37m\u001b[0m \u001b[1m0s\u001b[0m 9ms/step\n"
          ]
        },
        {
          "metadata": {
            "tags": null
          },
          "name": "stderr",
          "output_type": "stream",
          "text": [
            "[I 2025-11-30 04:02:56,845] Trial 33 finished with value: 0.537786414130693 and parameters: {'n_camadas': 3, 'n_neuronios': 188, 'dropout': 0.30534131296355205, 'ativacao': 'tanh', 'lr': 0.0009688148149924486, 'batch_size': 47}. Best is trial 12 with value: 0.5377274681678337.\n"
          ]
        },
        {
          "metadata": {
            "tags": null
          },
          "name": "stdout",
          "output_type": "stream",
          "text": [
            "\u001b[1m13/13\u001b[0m \u001b[32m━━━━━━━━━━━━━━━━━━━━\u001b[0m\u001b[37m\u001b[0m \u001b[1m0s\u001b[0m 7ms/step\n"
          ]
        },
        {
          "metadata": {
            "tags": null
          },
          "name": "stderr",
          "output_type": "stream",
          "text": [
            "[I 2025-11-30 04:03:08,851] Trial 34 finished with value: 0.5377616368820775 and parameters: {'n_camadas': 4, 'n_neuronios': 214, 'dropout': 0.22881974065969723, 'ativacao': 'tanh', 'lr': 0.006937228955293951, 'batch_size': 38}. Best is trial 12 with value: 0.5377274681678337.\n"
          ]
        },
        {
          "output_type": "stream",
          "name": "stdout",
          "text": [
            "\u001b[1m13/13\u001b[0m \u001b[32m━━━━━━━━━━━━━━━━━━━━\u001b[0m\u001b[37m\u001b[0m \u001b[1m0s\u001b[0m 8ms/step\n"
          ]
        },
        {
          "output_type": "stream",
          "name": "stderr",
          "text": [
            "[I 2025-11-30 04:03:26,358] Trial 35 finished with value: 0.5377523950617326 and parameters: {'n_camadas': 5, 'n_neuronios': 118, 'dropout': 0.47231930787246934, 'ativacao': 'tanh', 'lr': 0.0002625074141374636, 'batch_size': 28}. Best is trial 12 with value: 0.5377274681678337.\n"
          ]
        },
        {
          "output_type": "stream",
          "name": "stdout",
          "text": [
            "\u001b[1m13/13\u001b[0m \u001b[32m━━━━━━━━━━━━━━━━━━━━\u001b[0m\u001b[37m\u001b[0m \u001b[1m0s\u001b[0m 6ms/step \n"
          ]
        },
        {
          "output_type": "stream",
          "name": "stderr",
          "text": [
            "[I 2025-11-30 04:03:32,971] Trial 36 finished with value: 0.537786656687603 and parameters: {'n_camadas': 2, 'n_neuronios': 159, 'dropout': 0.114241824692763, 'ativacao': 'tanh', 'lr': 0.0025130344474407107, 'batch_size': 70}. Best is trial 12 with value: 0.5377274681678337.\n"
          ]
        },
        {
          "output_type": "stream",
          "name": "stdout",
          "text": [
            "\u001b[1m13/13\u001b[0m \u001b[32m━━━━━━━━━━━━━━━━━━━━\u001b[0m\u001b[37m\u001b[0m \u001b[1m0s\u001b[0m 7ms/step\n"
          ]
        },
        {
          "output_type": "stream",
          "name": "stderr",
          "text": [
            "[I 2025-11-30 04:03:42,374] Trial 37 finished with value: 10429.800831527082 and parameters: {'n_camadas': 4, 'n_neuronios': 175, 'dropout': 0.3680147809153927, 'ativacao': 'elu', 'lr': 0.0007110977707534586, 'batch_size': 51}. Best is trial 12 with value: 0.5377274681678337.\n"
          ]
        },
        {
          "output_type": "stream",
          "name": "stdout",
          "text": [
            "\u001b[1m13/13\u001b[0m \u001b[32m━━━━━━━━━━━━━━━━━━━━\u001b[0m\u001b[37m\u001b[0m \u001b[1m0s\u001b[0m 6ms/step\n"
          ]
        },
        {
          "output_type": "stream",
          "name": "stderr",
          "text": [
            "[I 2025-11-30 04:04:00,137] Trial 38 finished with value: 99.16132381922333 and parameters: {'n_camadas': 3, 'n_neuronios': 203, 'dropout': 0.26687442217572016, 'ativacao': 'relu', 'lr': 0.0039990019156662705, 'batch_size': 35}. Best is trial 12 with value: 0.5377274681678337.\n"
          ]
        },
        {
          "output_type": "stream",
          "name": "stdout",
          "text": [
            "\u001b[1m13/13\u001b[0m \u001b[32m━━━━━━━━━━━━━━━━━━━━\u001b[0m\u001b[37m\u001b[0m \u001b[1m0s\u001b[0m 10ms/step\n"
          ]
        },
        {
          "output_type": "stream",
          "name": "stderr",
          "text": [
