            "[I 2025-11-30 03:57:13,533] Trial 4 finished with value: 174231.54130689817 and parameters: {'n_camadas': 3, 'n_neuronios': 226, 'dropout': 0.29025732626830886, 'ativacao': 'elu', 'lr': 0.00011377453717786243, 'batch_size': 37}. Best is trial 2 with value: 0.5395143978056955.\n"
          ]
        },
        {
          "metadata": {
            "tags": null
          },
          "name": "stdout",
          "output_type": "stream",
          "text": [
            "\u001b[1m13/13\u001b[0m \u001b[32m━━━━━━━━━━━━━━━━━━━━\u001b[0m\u001b[37m\u001b[0m \u001b[1m0s\u001b[0m 5ms/step \n"
          ]
        },
        {
          "metadata": {
            "tags": null
          },
          "name": "stderr",
          "output_type": "stream",
          "text": [
            "[I 2025-11-30 03:57:25,527] Trial 5 finished with value: 0.5378024063038849 and parameters: {'n_camadas': 1, 'n_neuronios': 209, 'dropout': 0.337186956366614, 'ativacao': 'tanh', 'lr': 0.002952786889030835, 'batch_size': 50}. Best is trial 5 with value: 0.5378024063038849.\n"
          ]
        },
        {
          "metadata": {
            "tags": null
          },
          "name": "stdout",
          "output_type": "stream",
          "text": [
            "\u001b[1m13/13\u001b[0m \u001b[32m━━━━━━━━━━━━━━━━━━━━\u001b[0m\u001b[37m\u001b[0m \u001b[1m0s\u001b[0m 5ms/step \n"
          ]
        },
        {
          "metadata": {
            "tags": null
          },
          "name": "stderr",
          "output_type": "stream",
          "text": [
            "[I 2025-11-30 03:57:40,170] Trial 6 finished with value: 21986.88508151686 and parameters: {'n_camadas': 1, 'n_neuronios': 83, 'dropout': 0.05496916381864869, 'ativacao': 'relu', 'lr': 5.00532521864916e-05, 'batch_size': 91}. Best is trial 5 with value: 0.5378024063038849.\n"
          ]
        },
        {
          "metadata": {
            "tags": null
          },
          "name": "stdout",
          "output_type": "stream",
          "text": [
            "\u001b[1m13/13\u001b[0m \u001b[32m━━━━━━━━━━━━━━━━━━━━\u001b[0m\u001b[37m\u001b[0m \u001b[1m0s\u001b[0m 10ms/step\n"
          ]
        },
        {
          "metadata": {
            "tags": null
          },
          "name": "stderr",
          "output_type": "stream",
          "text": [
            "[I 2025-11-30 03:57:53,887] Trial 7 finished with value: 4355.315799851503 and parameters: {'n_camadas': 4, 'n_neuronios': 186, 'dropout': 0.034803710435066804, 'ativacao': 'elu', 'lr': 0.0005539508402531287, 'batch_size': 39}. Best is trial 5 with value: 0.5378024063038849.\n"
          ]
        },
        {
          "metadata": {
            "tags": null
          },
          "name": "stdout",
          "output_type": "stream",
          "text": [
            "\u001b[1m13/13\u001b[0m \u001b[32m━━━━━━━━━━━━━━━━━━━━\u001b[0m\u001b[37m\u001b[0m \u001b[1m0s\u001b[0m 7ms/step\n"
          ]
        },
        {
          "metadata": {
            "tags": null
          },
          "name": "stderr",
          "output_type": "stream",
          "text": [
            "[I 2025-11-30 03:58:04,230] Trial 8 finished with value: 42686.75767100883 and parameters: {'n_camadas': 4, 'n_neuronios': 42, 'dropout': 0.4766150496263145, 'ativacao': 'relu', 'lr': 9.805969423461544e-05, 'batch_size': 121}. Best is trial 5 with value: 0.5378024063038849.\n"
          ]
        },
        {
          "metadata": {
            "tags": null
          },
          "name": "stdout",
          "output_type": "stream",
          "text": [
            "\u001b[1m13/13\u001b[0m \u001b[32m━━━━━━━━━━━━━━━━━━━━\u001b[0m\u001b[37m\u001b[0m \u001b[1m0s\u001b[0m 5ms/step \n"
          ]
        },
        {
          "metadata": {
            "tags": null
          },
          "name": "stderr",
          "output_type": "stream",
          "text": [
            "[I 2025-11-30 03:58:23,462] Trial 9 finished with value: 1442.4155899067098 and parameters: {'n_camadas': 2, 'n_neuronios': 171, 'dropout': 0.044825293229352525, 'ativacao': 'elu', 'lr': 0.0009367530733947821, 'batch_size': 104}. Best is trial 5 with value: 0.5378024063038849.\n"
          ]
        },
        {
          "metadata": {
            "tags": null
          },
          "name": "stdout",
          "output_type": "stream",
          "text": [
            "\u001b[1m13/13\u001b[0m \u001b[32m━━━━━━━━━━━━━━━━━━━━\u001b[0m\u001b[37m\u001b[0m \u001b[1m0s\u001b[0m 7ms/step\n"
          ]
        },
        {
          "metadata": {
            "tags": null
          },
          "name": "stderr",
          "output_type": "stream",
          "text": [
            "[I 2025-11-30 03:58:38,054] Trial 10 finished with value: 0.5379239984195158 and parameters: {'n_camadas': 5, 'n_neuronios': 129, 'dropout': 0.41428049441948706, 'ativacao': 'tanh', 'lr': 0.008238529881396162, 'batch_size': 16}. Best is trial 5 with value: 0.5378024063038849.\n"
          ]
        },
        {
          "metadata": {
            "tags": null
          },
          "name": "stdout",
          "output_type": "stream",
          "text": [
            "\u001b[1m13/13\u001b[0m \u001b[32m━━━━━━━━━━━━━━━━━━━━\u001b[0m\u001b[37m\u001b[0m \u001b[1m0s\u001b[0m 8ms/step\n"
          ]
        },
        {
          "metadata": {
            "tags": null
          },
          "name": "stderr",
          "output_type": "stream",
          "text": [
            "[I 2025-11-30 03:58:53,078] Trial 11 finished with value: 0.5377495922412686 and parameters: {'n_camadas': 5, 'n_neuronios': 133, 'dropout': 0.4489700858447211, 'ativacao': 'tanh', 'lr': 0.008024347468724203, 'batch_size': 21}. Best is trial 11 with value: 0.5377495922412686.\n"
          ]
        },
        {
          "metadata": {
            "tags": null
          },
          "name": "stdout",
          "output_type": "stream",
          "text": [
            "\u001b[1m13/13\u001b[0m \u001b[32m━━━━━━━━━━━━━━━━━━━━\u001b[0m\u001b[37m\u001b[0m \u001b[1m0s\u001b[0m 8ms/step\n"
          ]
        },
        {
          "metadata": {
            "tags": null
          },
          "name": "stderr",
          "output_type": "stream",
          "text": [
            "[I 2025-11-30 03:59:02,216] Trial 12 finished with value: 0.5377274681678337 and parameters: {'n_camadas': 5, 'n_neuronios': 140, 'dropout': 0.3957598298656548, 'ativacao': 'tanh', 'lr': 0.009240587870945323, 'batch_size': 64}. Best is trial 12 with value: 0.5377274681678337.\n"
          ]
        },
        {
          "metadata": {
            "tags": null
          },
          "name": "stdout",
          "output_type": "stream",
          "text": [
            "\u001b[1m13/13\u001b[0m \u001b[32m━━━━━━━━━━━━━━━━━━━━\u001b[0m\u001b[37m\u001b[0m \u001b[1m0s\u001b[0m 7ms/step\n"
          ]
        },
        {
          "metadata": {
            "tags": null
          },
          "name": "stderr",
          "output_type": "stream",
          "text": [
            "[I 2025-11-30 03:59:12,723] Trial 13 finished with value: 0.5378010237856882 and parameters: {'n_camadas': 5, 'n_neuronios': 154, 'dropout': 0.4034909759225278, 'ativacao': 'tanh', 'lr': 1.1061010370077824e-05, 'batch_size': 64}. Best is trial 12 with value: 0.5377274681678337.\n"
          ]
        },
        {
          "metadata": {
            "tags": null
          },
          "name": "stdout",
          "output_type": "stream",
          "text": [
            "\u001b[1m13/13\u001b[0m \u001b[32m━━━━━━━━━━━━━━━━━━━━\u001b[0m\u001b[37m\u001b[0m \u001b[1m0s\u001b[0m 7ms/step\n"
          ]
        },
        {
          "metadata": {
            "tags": null
          },
          "name": "stderr",
          "output_type": "stream",
          "text": [
            "[I 2025-11-30 03:59:22,818] Trial 14 finished with value: 0.5379060288694899 and parameters: {'n_camadas': 5, 'n_neuronios': 94, 'dropout': 0.16262380827237, 'ativacao': 'tanh', 'lr': 0.009647394613729335, 'batch_size': 19}. Best is trial 12 with value: 0.5377274681678337.\n"
          ]
        },
        {
          "metadata": {
            "tags": null
          },
          "name": "stdout",
          "output_type": "stream",
          "text": [
            "\u001b[1m13/13\u001b[0m \u001b[32m━━━━━━━━━━━━━━━━━━━━\u001b[0m\u001b[37m\u001b[0m \u001b[1m1s\u001b[0m 52ms/step\n"
          ]
        },
        {
          "metadata": {
            "tags": null
          },
          "name": "stderr",
          "output_type": "stream",
          "text": [
            "[I 2025-11-30 03:59:29,906] Trial 15 finished with value: 0.5377277951183005 and parameters: {'n_camadas': 4, 'n_neuronios': 138, 'dropout': 0.48735478368782026, 'ativacao': 'tanh', 'lr': 0.0035771725703212043, 'batch_size': 66}. Best is trial 12 with value: 0.5377274681678337.\n"
          ]
        },
        {
          "metadata": {
            "tags": null
          },
          "name": "stdout",
          "output_type": "stream",
          "text": [
            "\u001b[1m13/13\u001b[0m \u001b[32m━━━━━━━━━━━━━━━━━━━━\u001b[0m\u001b[37m\u001b[0m \u001b[1m0s\u001b[0m 7ms/step\n"
          ]
        },
        {
          "metadata": {
            "tags": null
          },
          "name": "stderr",
          "output_type": "stream",
          "text": [
            "[I 2025-11-30 03:59:36,699] Trial 16 finished with value: 0.5378072113065044 and parameters: {'n_camadas': 4, 'n_neuronios': 66, 'dropout': 0.4966181949867107, 'ativacao': 'tanh', 'lr': 0.002732033533619787, 'batch_size': 65}. Best is trial 12 with value: 0.5377274681678337.\n"
          ]
        },
        {
          "metadata": {
            "tags": null
          },
          "name": "stdout",
          "output_type": "stream",
          "text": [
            "\u001b[1m13/13\u001b[0m \u001b[32m━━━━━━━━━━━━━━━━━━━━\u001b[0m\u001b[37m\u001b[0m \u001b[1m0s\u001b[0m 6ms/step\n"
          ]
        },
        {
          "metadata": {
            "tags": null
          },
          "name": "stderr",
          "output_type": "stream",
          "text": [
            "[I 2025-11-30 03:59:50,763] Trial 17 finished with value: 0.5377971441420552 and parameters: {'n_camadas': 3, 'n_neuronios': 164, 'dropout': 0.38570309384560664, 'ativacao': 'tanh', 'lr': 0.002905012778625762, 'batch_size': 82}. Best is trial 12 with value: 0.5377274681678337.\n"
          ]
        },
        {
          "metadata": {
            "tags": null
          },
          "name": "stdout",
          "output_type": "stream",
          "text": [
            "\u001b[1m13/13\u001b[0m \u001b[32m━━━━━━━━━━━━━━━━━━━━\u001b[0m\u001b[37m\u001b[0m \u001b[1m0s\u001b[0m 8ms/step\n"
          ]
        },
        {
          "metadata": {
            "tags": null
          },
          "name": "stderr",
          "output_type": "stream",
          "text": [
            "[I 2025-11-30 04:00:01,250] Trial 18 finished with value: 0.5378408617397196 and parameters: {'n_camadas': 4, 'n_neuronios': 109, 'dropout': 0.18083826630766026, 'ativacao': 'tanh', 'lr': 0.003928193814261834, 'batch_size': 56}. Best is trial 12 with value: 0.5377274681678337.\n"
          ]
        },
        {
          "metadata": {
            "tags": null
          },
          "name": "stdout",
          "output_type": "stream",
          "text": [
            "\u001b[1m13/13\u001b[0m \u001b[32m━━━━━━━━━━━━━━━━━━━━\u001b[0m\u001b[37m\u001b[0m \u001b[1m0s\u001b[0m 11ms/step\n"
          ]
        },
        {
          "metadata": {
            "tags": null
          },
          "name": "stderr",
          "output_type": "stream",
          "text": [
            "[I 2025-11-30 04:00:11,508] Trial 19 finished with value: 0.5378633587853361 and parameters: {'n_camadas': 5, 'n_neuronios': 141, 'dropout': 0.3583819331264869, 'ativacao': 'tanh', 'lr': 0.0012647758542370868, 'batch_size': 100}. Best is trial 12 with value: 0.5377274681678337.\n"
          ]
        },
        {
          "metadata": {
            "tags": null
          },
          "name": "stdout",
          "output_type": "stream",
          "text": [
            "\u001b[1m13/13\u001b[0m \u001b[32m━━━━━━━━━━━━━━━━━━━━\u001b[0m\u001b[37m\u001b[0m \u001b[1m0s\u001b[0m 6ms/step\n"
          ]
        },
        {
          "metadata": {
            "tags": null
          },
          "name": "stderr",
          "output_type": "stream",
          "text": [
            "[I 2025-11-30 04:00:19,823] Trial 20 finished with value: 0.5378352164211696 and parameters: {'n_camadas': 3, 'n_neuronios': 61, 'dropout': 0.448465704920324, 'ativacao': 'tanh', 'lr': 0.0005228581403919484, 'batch_size': 72}. Best is trial 12 with value: 0.5377274681678337.\n"
          ]
        },
        {
          "metadata": {
            "tags": null
          },
          "name": "stdout",
          "output_type": "stream",
          "text": [
            "\u001b[1m13/13\u001b[0m \u001b[32m━━━━━━━━━━━━━━━━━━━━\u001b[0m\u001b[37m\u001b[0m \u001b[1m0s\u001b[0m 7ms/step\n"
          ]
        },
        {
          "metadata": {
            "tags": null
          },
          "name": "stderr",
          "output_type": "stream",
          "text": [
            "[I 2025-11-30 04:00:30,691] Trial 21 finished with value: 0.5377276614161791 and parameters: {'n_camadas': 5, 'n_neuronios': 131, 'dropout': 0.44435737664381936, 'ativacao': 'tanh', 'lr': 0.005685446597103674, 'batch_size': 28}. Best is trial 12 with value: 0.5377274681678337.\n"
          ]
        },
        {
          "metadata": {
            "tags": null
          },
          "name": "stdout",
          "output_type": "stream",
          "text": [
            "\u001b[1m13/13\u001b[0m \u001b[32m━━━━━━━━━━━━━━━━━━━━\u001b[0m\u001b[37m\u001b[0m \u001b[1m0s\u001b[0m 7ms/step\n"
          ]
        },
        {
          "metadata": {
            "tags": null
          },
          "name": "stderr",
          "output_type": "stream",
          "text": [
            "[I 2025-11-30 04:00:41,720] Trial 22 finished with value: 0.538059728999804 and parameters: {'n_camadas': 5, 'n_neuronios': 118, 'dropout': 0.32838613453817467, 'ativacao': 'tanh', 'lr': 0.005385292827046857, 'batch_size': 30}. Best is trial 12 with value: 0.5377274681678337.\n"
          ]
        },
        {
          "metadata": {
            "tags": null
          },
          "name": "stdout",
          "output_type": "stream",
          "text": [
            "\u001b[1m13/13\u001b[0m \u001b[32m━━━━━━━━━━━━━━━━━━━━\u001b[0m\u001b[37m\u001b[0m \u001b[1m0s\u001b[0m 7ms/step\n"
          ]
        },
        {
          "metadata": {
            "tags": null
          },
          "name": "stderr",
          "output_type": "stream",
          "text": [
            "[I 2025-11-30 04:00:52,802] Trial 23 finished with value: 0.5377983328282844 and parameters: {'n_camadas': 4, 'n_neuronios': 145, 'dropout': 0.4432285644648594, 'ativacao': 'tanh', 'lr': 0.0021210714202497005, 'batch_size': 58}. Best is trial 12 with value: 0.5377274681678337.\n"
          ]
        },
        {
          "metadata": {
            "tags": null
          },
          "name": "stdout",
          "output_type": "stream",
          "text": [
            "\u001b[1m13/13\u001b[0m \u001b[32m━━━━━━━━━━━━━━━━━━━━\u001b[0m\u001b[37m\u001b[0m \u001b[1m0s\u001b[0m 10ms/step\n"
          ]
        },
        {
          "metadata": {
            "tags": null
          },
          "name": "stderr",
          "output_type": "stream",
          "text": [
            "[I 2025-11-30 04:01:00,635] Trial 24 finished with value: 0.5378011789468831 and parameters: {'n_camadas': 5, 'n_neuronios': 92, 'dropout': 0.4986578786396333, 'ativacao': 'tanh', 'lr': 0.005613226835978456, 'batch_size': 76}. Best is trial 12 with value: 0.5377274681678337.\n"
          ]
        },
        {
          "metadata": {
            "tags": null
          },
          "name": "stdout",
          "output_type": "stream",
          "text": [
            "\u001b[1m13/13\u001b[0m \u001b[32m━━━━━━━━━━━━━━━━━━━━\u001b[0m\u001b[37m\u001b[0m \u001b[1m0s\u001b[0m 7ms/step\n"
          ]
        },
        {
          "metadata": {
            "tags": null
          },
          "name": "stderr",
          "output_type": "stream",
          "text": [
            "[I 2025-11-30 04:01:13,527] Trial 25 finished with value: 0.5377408083090106 and parameters: {'n_camadas': 4, 'n_neuronios': 175, 'dropout': 0.3821332096272946, 'ativacao': 'tanh', 'lr': 0.0015142462322362662, 'batch_size': 31}. Best is trial 12 with value: 0.5377274681678337.\n"
          ]
        },
        {
          "metadata": {
            "tags": null
          },
          "name": "stdout",
          "output_type": "stream",
          "text": [
            "\u001b[1m13/13\u001b[0m \u001b[32m━━━━━━━━━━━━━━━━━━━━\u001b[0m\u001b[37m\u001b[0m \u001b[1m0s\u001b[0m 7ms/step\n"
          ]
        },
        {
          "metadata": {
            "tags": null
          },
          "name": "stderr",
          "output_type": "stream",
          "text": [
            "[I 2025-11-30 04:01:25,808] Trial 26 finished with value: 0.5378242656477898 and parameters: {'n_camadas': 5, 'n_neuronios': 163, 'dropout': 0.42041391614307233, 'ativacao': 'tanh', 'lr': 0.004402343253569714, 'batch_size': 44}. Best is trial 12 with value: 0.5377274681678337.\n"
          ]
        },
        {
          "metadata": {
            "tags": null
          },
          "name": "stdout",
          "output_type": "stream",
          "text": [
            "\u001b[1m13/13\u001b[0m \u001b[32m━━━━━━━━━━━━━━━━━━━━\u001b[0m\u001b[37m\u001b[0m \u001b[1m0s\u001b[0m 6ms/step\n"
          ]
        },
        {
          "metadata": {
            "tags": null
          },
          "name": "stderr",
          "output_type": "stream",
          "text": [
            "[I 2025-11-30 04:01:32,928] Trial 27 finished with value: 0.5378079742187173 and parameters: {'n_camadas': 3, 'n_neuronios': 126, 'dropout': 0.19493943243104314, 'ativacao': 'tanh', 'lr': 0.0097970146701971, 'batch_size': 90}. Best is trial 12 with value: 0.5377274681678337.\n"
          ]
        },
        {
          "metadata": {
            "tags": null
          },
          "name": "stdout",
          "output_type": "stream",
          "text": [
            "\u001b[1m13/13\u001b[0m \u001b[32m━━━━━━━━━━━━━━━━━━━━\u001b[0m\u001b[37m\u001b[0m \u001b[1m0s\u001b[0m 11ms/step\n"
          ]
        },
        {
          "metadata": {
            "tags": null
          },
          "name": "stderr",
          "output_type": "stream",
          "text": [
            "[I 2025-11-30 04:01:49,738] Trial 28 finished with value: 0.6915535811272309 and parameters: {'n_camadas': 4, 'n_neuronios': 151, 'dropout': 0.4645051830719983, 'ativacao': 'elu', 'lr': 0.0018765734528670714, 'batch_size': 55}. Best is trial 12 with value: 0.5377274681678337.\n"
          ]
        },
        {
          "metadata": {
            "tags": null
          },
          "name": "stdout",
          "output_type": "stream",
          "text": [
            "\u001b[1m13/13\u001b[0m \u001b[32m━━━━━━━━━━━━━━━━━━━━\u001b[0m\u001b[37m\u001b[0m \u001b[1m0s\u001b[0m 7ms/step\n"
          ]
        },
        {
          "metadata": {
            "tags": null
          },
          "name": "stderr",
          "output_type": "stream",
          "text": [
            "[I 2025-11-30 04:01:56,572] Trial 29 finished with value: 108158.3789311336 and parameters: {'n_camadas': 5, 'n_neuronios': 103, 'dropout': 0.33247475386300573, 'ativacao': 'relu', 'lr': 0.00044179661065509593, 'batch_size': 65}. Best is trial 12 with value: 0.5377274681678337.\n"
          ]
        },
        {
          "metadata": {
            "tags": null
          },
          "name": "stdout",
          "output_type": "stream",
          "text": [
            "\u001b[1m13/13\u001b[0m \u001b[32m━━━━━━━━━━━━━━━━━━━━\u001b[0m\u001b[37m\u001b[0m \u001b[1m0s\u001b[0m 8ms/step\n"
          ]
        },
        {
          "metadata": {
            "tags": null
          },
          "name": "stderr",
          "output_type": "stream",
          "text": [
            "[I 2025-11-30 04:02:08,804] Trial 30 finished with value: 90.79590368340489 and parameters: {'n_camadas': 5, 'n_neuronios': 248, 'dropout': 0.36562435094199286, 'ativacao': 'relu', 'lr': 0.005094377470508092, 'batch_size': 115}. Best is trial 12 with value: 0.5377274681678337.\n"
          ]
        },
        {
          "metadata": {
            "tags": null
          },
          "name": "stdout",
          "output_type": "stream",
          "text": [
            "\u001b[1m13/13\u001b[0m \u001b[32m━━━━━━━━━━━━━━━━━━━━\u001b[0m\u001b[37m\u001b[0m \u001b[1m0s\u001b[0m 12ms/step\n"
          ]
        },
        {
          "metadata": {
            "tags": null
          },
          "name": "stderr",
          "output_type": "stream",
          "text": [
            "[I 2025-11-30 04:02:25,525] Trial 31 finished with value: 0.53787410799068 and parameters: {'n_camadas': 4, 'n_neuronios': 179, 'dropout': 0.3897301932794792, 'ativacao': 'tanh', 'lr': 0.0015948200890281868, 'batch_size': 28}. Best is trial 12 with value: 0.5377274681678337.\n"
          ]
        },
        {
          "metadata": {
            "tags": null
          },
          "name": "stdout",
          "output_type": "stream",
          "text": [
            "\u001b[1m13/13\u001b[0m \u001b[32m━━━━━━━━━━━━━━━━━━━━\u001b[0m\u001b[37m\u001b[0m \u001b[1m0s\u001b[0m 7ms/step\n"
          ]
        },
        {
          "metadata": {
            "tags": null
          },
          "name": "stderr",
          "output_type": "stream",
          "text": [
